,"Consolidated Statements of Income - USD ($)  shares in Millions, $ in Millions",12 Months Ended,12 Months Ended,12 Months Ended
,"Consolidated Statements of Income - USD ($)  shares in Millions, $ in Millions","Dec. 31, 2019","Dec. 31, 2018","Dec. 31, 2017"
0,Revenues,"$ 25,599.7","$ 23,495.7","$ 19,456.4"
1,Provision for losses on receivables,15.4,16.5,22.3
2,Investment income,82.3,60.9,35.3
3,Income before income taxes,3099.2,2810.2,2173.3
4,Income taxes,711.3,615.1,498.1
5,Net Income,"$ 2,387.9","$ 2,195.1","$ 1,675.2"
6,Net Income Per Share,,,
7,Basic,$ 6.88,$ 6.25,$ 4.76
8,Diluted,$ 6.87,$ 6.24,$ 4.75
9,Weighted Average Number of Common Shares Outstanding,,,
10,Basic,346.9,351.0,351.9
11,Diluted,347.5,351.8,352.9
12,"Truck, Parts and Other",,,
13,Net sales and revenues,"$ 24,119.7","$ 22,138.6","$ 18,187.5"
14,Cost of sales and revenues,20555.6,18925.0,15628.9
15,Research and development,326.6,306.1,264.7
16,"Selling, general and administrative",561.5,524.9,464.0
17,"Interest and other (income), net",(42.0),(60.8),(46.4)
18,"Costs and Expenses, Total",21401.7,19695.2,16311.2
19,Income before income taxes,2718.0,2443.4,1876.3
20,Financial Services,,,
21,Interest and fees,583.0,497.7,431.1
22,"Operating lease, rental and other revenues",897.0,859.4,837.8
23,Revenues,1480.0,1357.1,1268.9
24,Interest and other borrowing expenses,230.5,186.9,149.6
25,Depreciation and other expenses,798.2,728.0,727.5
26,"Selling, general and administrative",137.0,119.8,107.8
27,Provision for losses on receivables,15.4,16.5,22.3
28,"Costs and Expenses, Total",1181.1,1051.2,1007.2
29,Income before income taxes,$ 298.9,$ 305.9,$ 261.7
