,0,1
0,[1],"Goodwill and trademark impairment charges in the fourth quarter of 2010 reduced operating results as follows: operating income – $201.7 million; net income – $141.8 million; basic earnings per share – $1.31 ($1.30 for full year); and diluted earnings per share – $1.29. See Notes F, G and T."
1,[2],"Goodwill and trademark impairment changes in the fourth quarter of 2009 reduced operating results as follows: operating income – $122.0 million; net income – $114.4 million; basic earnings per share – $1.04; and diluted earnings per share – $1.02 ($1.03 for full year). See Notes F, G and T."
2,[3],Results in 2008 and 2009 have been revised to reflect the 2010 reclassification of the lucy® business unit from Contemporary Brands Coalition to the Outdoor & Actions Sports Coalition.
3,[4],"Restructuring costs in the fourth quarter of 2008 reduced operating results as follows: operating income – $41.0 million; net income – $32.8 million, and basic and diluted earnings per share – $0.30."
4,[5],"Goodwill and trademark impairment charges totaling $201.7 million in the fourth quarter of 2010 related to Contemporary Brands and totaling $122.0 million in the fourth quarter of 2009 related to: Outdoor & Action Sports – $63.5 million and Sportswear – $58.5 million. See Notes F, G, and T."
