,0,1,2,3,4,5,6
0,[1],"For 2011, includes King commencing on the acquisition date of January 31, 2011. For 2009, includes Wyeth commencing on the acquisition date of October 15, 2009.",,,,,
1,[2],"Exclusive of amortization of intangible assets, except as disclosed in Note 1K. Significant Accounting Policies: Amortization of Intangible Assets, Depreciation and Certain Long-Lived Assets.",,,,,
2,[3],"From the beginning of our cost-reduction and productivity initiatives in 2005 through December 31, 2011, Employee termination costs represent the expected reduction of the workforce by approximately 57,400 employees, mainly in manufacturing and sales and research, of which approximately 42,800 employees have been terminated as of December 31, 2011. Employee termination costs are generally recorded when the actions are probable and estimable and include accrued severance benefits, pension and postretirement benefits, many of which may be paid out during periods after termination. Asset impairments primarily include charges to write down property, plant and equipment to fair value. Other primarily includes costs to exit certain assets and activities. The restructuring charges in 2011 are associated with the following: • Primary Care operating segment ($593 million), Specialty Care and Oncology operating segment ($220 million), Established Products and Emerging Markets operating segment ($110 million), Animal Health and Consumer Healthcare operating segment ($51 million), Nutrition operating segment ($4 million), research and development operations ($489 million), manufacturing operations ($280 million) and Corporate ($427 million). The restructuring charges in 2010 are associated with the following: • Primary Care operating segment ($71 million), Specialty Care and Oncology operating segment ($197 million), Established Products and Emerging Markets operating segment ($43 million), Animal Health and Consumer Healthcare operating segment ($46 million), Nutrition operating segment ($4 million), research and development operations ($292 million), manufacturing operations ($1.1 billion) and Corporate ($455 million). The restructuring charges in 2009 are associated with the following: • Our three biopharmaceutical operating segments ($1.3 billion), Animal Health and Consumer Healthcare operating segment ($250 million), Nutrition operating segment ($4 million income), research and development operations ($339 million), manufacturing operations ($292 million) and Corporate ($781 million).",,,,,
3,[4],"2010 vs. 2009 - The decrease in the domestic loss was due to revenues from legacy Wyeth products and a reduction in domestic restructuring charges partially offset by increased amortization charges primarily related to identifiable intangibles in connection with our acquisition of Wyeth and litigation charges primarily related to our wholly owned subsidiary Quigley Company, Inc. The decrease in international income was due primarily to an increase in international restructuring and amortization charges plus the non-recurrence of the gain in 2009 in connection with the formation of ViiV, partially offset by revenues from legacy Wyeth products.",,,,,
4,[5],Income from continuing operations before provision for taxes on income.,,,,,
5,[6],"2011 vs. 2010 - The decrease in the domestic loss was primarily due to the non-recurrence of a charge of $1.3 billion (pre-tax) in 2010 for asbestos litigation related to our wholly owned subsidiary, Quigley Company, Inc., partially offset by a reduction in revenues due to the loss of exclusivity for several biopharmaceutical products and the impact of the U.S. Healthcare Legislation. The increase in international income was due to the favorable impact of foreign exchange, higher impairment charges in 2010, as well as increased revenues from the biopharmaceutical products such as the Prevnar/Prevenar franchise, Enbrel and Celebrex.",,,,,
6,[7],"In 2011, federal, state and international net tax liabilities assumed or established on the date of the acquisition primarily of King are excluded. In 2010 and 2009, federal, state and international net tax liabilities assumed or established on the date of the acquisition primarily of Wyeth are excluded. (See Note 2A. Acquisitions, Divestitures, Collaborative Arrangements and Equity-Method Investments: Acquisition of Wyeth and Note 2B. Acquisitions, Divestitures, Collaborative Arrangements and Equity-Method Investments: Acquisition of King Pharmaceuticals, Inc.)",,,,,
7,[8],EPS amounts may not add due to rounding.,,,,,
8,"Consolidated Statements of Income (USD $) In Millions, except Per Share data, unless otherwise specified",12 Months Ended,12 Months Ended,12 Months Ended,12 Months Ended,12 Months Ended,12 Months Ended
9,"Consolidated Statements of Income (USD $) In Millions, except Per Share data, unless otherwise specified","Dec. 31, 2011","Dec. 31, 2011","Dec. 31, 2010","Dec. 31, 2010","Dec. 31, 2009","Dec. 31, 2009"
10,Revenues,"$ 67,425",[1],"$ 67,057",[1],"$ 49,269",[1]
11,Costs and expenses:,,,,,,
12,Cost of sales,15085,[2],15838,[2],8459,[2]
13,"Selling, informational and administrative expenses",19468,[2],19480,[2],14752,[2]
14,Research and development expenses,9112,"[1],[2]",9392,[2],7824,"[1],[2]"
15,Amortization of intangible assets,5585,,5403,,2877,
16,Acquisition-related in-process research and development charges,,,125,,68,
17,Restructuring charges and certain acquisition-related costs,2934,[3],3201,[3],4330,[3]
18,Other deductions-net,2479,,4336,,285,
19,Income from continuing operations before provision for taxes on income,12762,"[1],[4],[5],[6]",9282,"[4],[5],[6]",10674,"[1],[4],[5],[6]"
20,Provision for taxes on income,4023,[7],1071,[7],2145,[7]
21,Income from continuing operations,8739,,8211,,8529,
22,Discontinued operations:,,,,,,
23,Income from discontinued operations-net of tax,8,,88,,97,
24,Gain/(loss) on sale of discontinued operations-net of tax,1304,,(11),,17,
25,Discontinued operations-net of tax,1312,,77,,114,
26,Net income before allocation to noncontrolling interests,10051,,8288,,8643,
27,Less: Net income attributable to noncontrolling interests,42,,31,,8,
28,Net income attributable to Pfizer Inc.,"$ 10,009",,"$ 8,257",,"$ 8,635",
29,Earnings per common share-basic:,,,,,,
30,Income from continuing operations attributable to Pfizer Inc. common shareholders,$ 1.11,,$ 1.02,,$ 1.22,
31,Discontinued operations-net of tax,$ 0.17,,$ 0.01,,$ 0.02,
32,Net income attributable to Pfizer Inc. common shareholders,$ 1.28,[8],$ 1.03,[8],$ 1.23,[8]
33,Earnings per common share-diluted:,,,,,,
34,Income from continuing operations attributable to Pfizer Inc. common shareholders,$ 1.11,,$ 1.01,,$ 1.21,
35,Discontinued operations-net of tax,$ 0.17,,$ 0.01,,$ 0.02,
36,Net income attributable to Pfizer Inc. common shareholders,$ 1.27,[8],$ 1.02,[8],$ 1.23,[8]
37,Weighted-average shares-basic,7817,,8036,,7007,
38,Weighted-average shares-diluted,7870,,8074,,7045,
39,,,,,,,
