,0,1
0,[1],Amounts may not add due to rounding.
1,[2],"Exclusive of amortization of intangible assets, except as disclosed in Note 1K. Basis of Presentation and Significant Accounting Policies: Amortization of Intangible Assets, Depreciation and Certain Long-Lived Assets."
2,[3],"2016 v. 2015––The increase in the domestic loss was primarily due to a charge related to the write-down of HIS net assets to fair value less estimated costs to sell, higher asset impairments, and higher restructuring charges and certain acquisition-related costs, partially offset by the inclusion of a full year of legacy U.S. Hospira operations as compared to four months of U.S. operations in 2015, and lower charges for legal matters. The increase in international income is primarily due to the non-recurrence of a foreign currency loss related to Venezuela partially offset by a charge related to the write-down of HIS net assets to fair value less estimated costs to sell, and higher restructuring charges and certain acquisition-related costs."
3,[4],"2017 v. 2016––The decrease in the domestic loss was primarily due to lower restructuring charges and certain acquisition-related costs, the non-recurrence of the 2016 impairment on the remeasurement of HIS net assets, lower certain asset impairments and lower certain legal matters, partially offset by higher net losses on early retirement of debt, and higher amortization of intangible assets. The increase in international income was primarily due to the non-recurrence of the 2016 impairment on the remeasurement of HIS net assets, lower restructuring charges and certain acquisition-related costs, and lower certain asset impairments."
4,[5],"Income from continuing operations before provision/(benefit) for taxes on income. IH’s earnings in 2017 include dividend income of $266 million from our investment in ViiV. For additional information, see Note 4."
5,[6],Amounts may not add due to rounding.
6,[7],Amounts may not add due to rounding.
7,[8],Amounts may not add due to rounding.
8,[9],2017 shares include the effect of the modification for a commitment to pay 15.2 million common-share equivalents that were scheduled for near-term settlement.
