,0,1
0,[1],Net sales are attributed to countries based on the location of the seller.
1,[2],Excludes accelerated depreciation related to the closure and/or repurposing of mills in 2016.
2,[3],Prior years recast to reflect current methodology for allocation of Corporate depreciation and amortization to the business segments. There is no change to segment operating profit.
3,[4],Includes the following pre-tax charges (gains): 2018In millions Q1 Q2 Q3 Q4Smurfit-Kappa acquisition proposal costs $— $12 $— $—Legal settlement 9 — — —Litigation settlement recovery — — — (5)Environmental remediation reserve adjustment — — 9 —EMEA Packaging optimization 22 26 — (1)Abandoned property removal 9 9 6 8Riverdale mill conversion costs — — 5 4Brazil Packaging impairment — — 122 —Debt extinguishment costs — — — 10Gain on sale of investment in Liaison Technologies — — — (31)Non-operating pension expense 4 36 25 429Total $44 $83 $167 $414
4,[5],Includes the following pre-tax charges (gains): 2017In millions Q1 Q2 Q3 Q4Gain on sale of investment in ArborGen $— $(14) $— $—Costs associated with the pulp business acquired in 2016 4 5 6 18Amortization of Weyerhaeuser inventory fair value step-up 14 — — —Holmen bargain purchase gain (6) — — —Abandoned property removal 2 5 7 6Kleen Products settlement — 354 — —Asia Foodservice sale — 9 — —Brazil Packaging wood supply accelerated amortization — — 10 —Debt extinguishment costs — — — 83Interest income on income tax refund claims — (4) — (1)Other items — (2) — —Non-operating pension expense 31 34 33 386Total $45 $387 $56 $492
5,[6],Includes the following pre-tax charges (gains): 2018In millions Q1 Q2 Q3 Q4North American Consumer Packaging transaction costs $23 $2 $— $—North American Consumer Packaging gain on transfer (516) 28 — —Total $(493) $30 $— $—
6,[7],ncludes the operating earnings of the North American Consumer Packaging business for the full year. Also includes the following pre-tax charges (gains): 2017In millions Q1 Q2 Q3 Q4North American Consumer Packaging transaction costs $— $— $— $17Non-operating pension expense — — — 45Total $— $— $— $62
7,[8],Includes the following tax expenses (benefits): 2018In millions Q1 Q2 Q3 Q4State income tax legislative changes $— $9 $— $—Tax benefit of Tax Cuts and Jobs Act — — (36) —International investment restructuring — — — 19Foreign tax audits — — — 25Tax impact of other special items (9) (13) (46) 3Tax impact of non-operating pension expense (1) (9) (6) (107)Total $(10) $(13) $(88) $(60)
8,[9],"Includes the following tax expenses (benefits): 2017In millions Q1 Q2 Q3 Q4International legal entity restructuring $15 $— $19 $—Income tax refund claims — (85) — (28)Cash pension contribution — 38 — —International tax law change — — — 9Tax benefit of Tax Cuts and Jobs Act — — — (1,222)Tax impact of other special items (8) (137) (8) (41)Tax impact of non-operating pension expense (12) (13) (13) (148)Total $(5) $(197) $(2) $(1,430)"
