,0,1
0,[1],"In the fourth quarter of 2011 and 2010, the Company recognized a pre-tax loss of approximately $108 million and a pre-tax gain of approximately $176 million, respectively, in net revenues upon application of the OIS curve within the Institutional Securities business segment (see Note 4)."
1,[2],"Interest income and expense are recorded within the consolidated statements of income depending on the nature of the instrument and related market conventions. When interest is included as a component of the instrument’s fair value, interest is included within Principal transactions—Trading revenues or Principal transactions—Investments revenues. Otherwise, it is included within Interest income or Interest expense."
2,[3],Amounts included eliminations of intersegment activity.
3,[4],See Notes 1 and 25 for discussion of discontinued operations.
4,[5],"Amounts for 2010 included a loss of $1.2 billion related to the disposition of Revel included within the Institutional Securities business segment, a gain of approximately $570 million related to the Company’s sale of Retail Asset Management within the Asset Management business segment and a gain of $775 million related to the legal settlement with DFS. Amounts for 2009 included net gains of $499 million related to MSCI secondary offerings within the Institutional Securities business segment."
