,0,1
0,[1],Revenues are attributed to countries based on the location of the customer.
1,[2],Included a charge of $16 million ($8 million to net income attributable to FCX common stockholders or $0.01 per share) in the fourth quarter and for the year associated with labor agreements at Candelaria. Also included charges of $9 million ($7 million to net income attributable to FCX common stockholders or $0.01 per share) for costs associated with the PXP and MMR transactions.
2,[3],Included a gain of $59 million ($31 million to net income attributable to FCX common stockholders or $0.03 per share) in the fourth quarter and for the year for the settlement of the insurance claim for business interruption and property damage relating to the 2011 incidents affecting PT Freeport Indonesia's concentrate pipelines. Refer to Note 13 for further discussion.
3,[4],"Included charges totaling $116 million ($50 million to net income attributable to common stock or $0.05 per share) in the fourth quarter and for the year primarily associated with bonuses for new labor agreements and other employee costs at PT Freeport Indonesia, Cerro Verde and El Abra."
4,[5],Included a net tax benefit of $208 million ($108 million attributable to noncontrolling interests and $100 million to net income attributable to FCX common stockholders or $0.11 per share) in the third quarter and $205 million ($107 million attributable to noncontrolling interests and $98 million to net income attributable to FCX common stockholders or $0.11 per share) for the year associated with adjustments to Cerro Verde's deferred income taxes. Refer to Note 12 for further discussion.
5,[6],Included losses on early extinguishment of debt totaling $149 million ($0.16 per share) in the first quarter and for the year. Refer to Note 9 for further discussion.
6,[7],Included additional taxes of $50 million ($0.05 per share) in the third quarter and $49 million ($0.05 per share) for the year associated with Cerro Verde's election to pay a special mining burden during the remaining term of its current stability agreement. Refer to Note 12 for further discussion.
7,[8],"Included losses on early extinguishment of debt totaling $6 million ($0.01 per share) in the first quarter, $54 million ($0.06 per share) in the second quarter and $60 million ($0.06 per share) for the year. Refer to Note 9 for further discussion."
