,0,1
0,[1],"Total revenues are net of sales incentives of $361.7 million ($33,700 per home delivered) for the year ended November 30, 2011, $356.5 million ($32,800 per home delivered) for the year ended November 30, 2010 and $512.0 million ($44,800 per home delivered) for the year ended November 30, 2009."
1,[2],"Benefit for income taxes for the year ended November 30, 2011 and 2010 primarily related to settlements with various taxing authorities. For the year ended November 30, 2009, benefit for income taxes includes a reversal of the Company's deferred tax asset valuation allowance of $351.8 million."
2,[3],"Net earnings (loss) attributable to noncontrolling interests for the years ended November 30, 2011 and 2010 includes $28.9 million and $33.2 million of earnings, respectively, related to the FDIC's interest in the portfolio of real estate loans that the Company acquired in partnership with the FDIC. Net earnings (loss) attributable to noncontrolling interests for the year ended November 30, 2009 includes ($13.6) million recorded as a result of $27.2 million of valuation adjustments to inventories of a 50%-owned consolidated joint venture."
3,[4],"Lennar Homebuilding costs and expenses include $38.0 million, $51.3 million and $373.5 million, respectively, of valuation adjustments and write-offs of option deposits and pre-acquisition costs for the years ended November 30, 2011, 2010 and 2009."
4,[5],"Lennar Homebuilding equity in loss from unconsolidated entities includes $8.9 million of the Company's share of valuation adjustments related to assets of unconsolidated entities for the years ended November 30, 2011. In addition, it includes a $57.6 million valuation adjustment related to an asset distribution from a Lennar Homebuilding unconsolidated entity, which was the result of a linked transaction where there was also a pre-tax gain disclosed below. Lennar Homebuilding equity in loss from unconsolidated entities for the years ended November 30, 2010 and 2009 includes $10.5 million and $101.9 million, respectively, of the Company's share of valuation adjustments related to assets of unconsolidated entities."
5,[6],"Lennar Homebuilding other income (expense), net includes $15.4 million, $3.3 million and $98.6 million, respectively, of valuation adjustments to investments in Lennar Homebuilding unconsolidated entities and write-offs of notes receivables and other assets for the years ended November 30, 2011, 2010 and 2009. In addition, for the year ended November 30, 2011, Lennar Homebuilding other income (expense), net includes a pre-tax gain of $62.3 million related to an asset distribution from a Lennar Homebuilding unconsolidated entity in a linked transaction where there was also a valuation adjustment disclosed above."
