,0,1
0,[1],"(4)On November 2, 2011, our Board of Directors approved a change to our fiscal year-end from the Saturday nearest the end of February to the Saturday nearest the end of January. In the first quarter of fiscal 2013 (11-month), we began reporting our quarterly results on the basis of our new fiscal year-end. As such, the results for the month of February 2012, which are included in the audited results for fiscal 2012, were also included in the reported first quarter of fiscal 2013 (11-month). However, the results for the month of February 2012 are not included in the results for the full year of fiscal 2013 (11-month). Thus, the four quarters of fiscal year 2013 (11-month) are not additive."
1,[2],"(5)Includes $127 million, $91 million, $34 million and $169 million of restructuring charges recorded in the fiscal first, second, third and fourth quarters, respectively, and $415 million for the 11 months ended February 2, 2013, related to measures we took to restructure our businesses. Also included in the fourth quarter and 11 months ended February 2, 2013, is a $822 million goodwill impairment charge related to our Canada, Five Star and U.S. reporting units."
2,[3],"Includes $6 million, $7 million, $31 million and $115 million of restructuring charges recorded in the fiscal first, second, third and fourth quarters, respectively, and $159 million for the 12 months ended February 1, 2014, related to measures we took to restructure our businesses."
3,[4],"(1)The calculation of diluted loss per share for fiscal 2013 (11-month) does not include potentially dilutive securities because their inclusion would be anti-dilutive (i.e., reduce the net loss per share)."
4,[5],The sum of our quarterly diluted earnings per share does not equal our annual diluted earnings per share due to the impact of the timing of the repurchases of common stock and stock option exercises on quarterly and annual weighted-average shares outstanding.
